item,qty,unit,estimated_cost,notes
Low-fire or mid-fire clay body,5,lb,derived estimate 12,Enough for two small prototypes and test tiles
Calibrated syringe or graduated cylinder,1,each,derived estimate 8,Water-fill cavity volume measurement
Digital caliper,1,each,shop tool,Measure hole diameters and wall thickness
Needle files and reamers,1,set,derived estimate 18,Gradual hole enlargement
Small drill index,1,set,derived estimate 20,Undersize tuning holes
Plaster for test mold,5,lb,derived estimate 15,Only after hand-built body validates
Food-safe shellac or ceramic finish test,1,set,derived estimate 10,Prototype sealing and surface tests
